[
    {
        "header": "YouTube",
        "title": "Watched How to Make Pasta at Home",
        "titleUrl": "https://www.youtube.com/watch?v=abc123",
        "subtitles": [
            {
                "name": "Cooking Channel",
                "url": "https://www.youtube.com/channel/UC000001"
            }
        ],
        "time": "2025-06-15T10:30:00.000Z",
        "products": ["YouTube"],
        "activityControls": ["YouTube watch history"]
    },
    {
        "header": "YouTube",
        "title": "Watched Ad - Buy Something 30s",
        "titleUrl": "https://www.youtube.com/watch?v=ad456",
        "time": "2025-06-15T10:25:00.000Z",
        "products": ["YouTube"],
        "details": [{"name": "From Google Ads"}],
        "activityControls": ["YouTube watch history"]
    },
    {
        "header": "YouTube",
        "title": "Searched for pasta recipes",
        "titleUrl": "https://www.youtube.com/results?search_query=pasta+recipes",
        "time": "2025-06-15T10:20:00.000Z",
        "products": ["YouTube"],
        "activityControls": ["YouTube search history"]
    },
    {
        "header": "YouTube",
        "title": "Liked How to Make Pasta at Home",
        "titleUrl": "https://www.youtube.com/watch?v=abc123",
        "subtitles": [
            {
                "name": "Cooking Channel",
                "url": "https://www.youtube.com/channel/UC000001"
            }
        ],
        "time": "2025-06-15T10:35:00.000Z",
        "products": ["YouTube"]
    },
    {
        "header": "YouTube",
        "title": "Disliked Worst Pasta Recipe Ever",
        "titleUrl": "https://www.youtube.com/watch?v=bad789",
        "subtitles": [
            {
                "name": "Bad Chef",
                "url": "https://www.youtube.com/channel/UC000002"
            }
        ],
        "time": "2025-06-15T10:40:00.000Z",
        "products": ["YouTube"]
    },
    {
        "header": "YouTube",
        "title": "Subscribed to Cooking Channel",
        "titleUrl": "https://www.youtube.com/channel/UC000001",
        "time": "2025-06-15T10:36:00.000Z",
        "products": ["YouTube"]
    },
    {
        "header": "YouTube",
        "title": "Saved How to Make Pasta at Home",
        "titleUrl": "https://www.youtube.com/watch?v=abc123",
        "subtitles": [
            {
                "name": "Cooking Channel",
                "url": "https://www.youtube.com/channel/UC000001"
            }
        ],
        "time": "2025-06-15T10:37:00.000Z",
        "products": ["YouTube"]
    },
    {
        "header": "YouTube",
        "title": "Shared video",
        "titleUrl": "https://www.youtube.com/watch?v=abc123",
        "subtitles": [
            {
                "name": "Shared URL: https://www.youtube.com/watch?v=abc123"
            }
        ],
        "time": "2025-06-15T10:38:00.000Z",
        "products": ["YouTube"]
    }
]

